{
  "id": "zod__004",
  "repo": "https://github.com/colinhacks/zod",
  "base_commit": "e516c3baf22615e20934116abebfed6c000222c2",
  "language": "TypeScript",
  "task_a": "Replace existing set-size checks when applying a new set .min() constraint.",
  "task_b": "Refactor set .nonempty() to delegate to .min(1) while preserving other cardinality checks.",
  "patch_a": "patch_a.patch",
  "patch_b": "patch_b.patch",
  "validation_a": "scripts/validate_a.sh",
  "validation_b": "scripts/validate_b.sh",
  "merge_result": "Patch A and Patch B apply cleanly to the same base commit with git apply; no textual conflict is reported.",
  "composition_oracle": "oracle/test_composition.ts",
  "composition_expected": "fail",
  "conflict_type": "state_invariant",
  "failure_summary": "Patch A changes set min() so it clears existing checks. Patch B refactors nonempty() to call min(1). Together, nonempty() clears a prior max() constraint and accepts sets that are too large.",
  "difficulty": "easy",
  "source": "researcher_constructed",
  "agent_or_model": "Codex",
  "human_modified": true,
  "notes": "Zod set-cardinality interaction between helper semantics and public convenience-method delegation."
}
