{
  "id": "commander__004",
  "repo": "https://github.com/tj/commander.js",
  "base_commit": "ba6d13ddb4243e5913367734f8c159089ffe7834",
  "language": "JavaScript",
  "task_a": "Allow Argument.argOptional() to clear stale default values when converting required arguments into optional arguments.",
  "task_b": "Allow Command.addArgument() to treat prepared required arguments with defaults as optional fallback arguments.",
  "patch_a": "patch_a.patch",
  "patch_b": "patch_b.patch",
  "validation_a": "scripts/validate_a.sh",
  "validation_b": "scripts/validate_b.sh",
  "merge_result": "Patch A and Patch B apply cleanly to the same base commit with git apply; no textual conflict is reported.",
  "composition_oracle": "oracle/test_composition.mjs",
  "composition_expected": "fail",
  "conflict_type": "api_contract",
  "failure_summary": "Patch A changes argOptional() so it clears default values. Patch B starts using argOptional() to reinterpret required arguments with defaults as optional fallback arguments. Together, the fallback value is silently discarded, so a missing argument resolves to undefined instead of the configured default.",
  "difficulty": "easy",
  "source": "researcher_constructed",
  "agent_or_model": "Codex",
  "human_modified": true,
  "notes": "Commander.js API-contract interaction around default-bearing positional arguments and helper reuse."
}
