{
  "id": "httpx__003",
  "repo": "https://github.com/encode/httpx",
  "base_commit": "b5addb64f0161ff6bfe94c124ef76f6a1fba5254",
  "language": "Python",
  "task_a": "Preserve original header casing when exposing Headers.keys().",
  "task_b": "Optimize Headers.update by removing existing entries through direct normalized-key matching.",
  "patch_a": "patch_a.patch",
  "patch_b": "patch_b.patch",
  "validation_a": "scripts/validate_a.sh",
  "validation_b": "scripts/validate_b.sh",
  "merge_result": "Patch A and Patch B apply cleanly to the same base commit with git apply; no textual conflict is reported.",
  "composition_oracle": "oracle/test_composition.py",
  "composition_expected": "fail",
  "conflict_type": "state_invariant",
  "failure_summary": "Patch A makes Headers.keys() expose original-case header names. Patch B optimizes Headers.update() by directly comparing incoming keys against normalized lookup keys. Together, an update with different casing fails to remove the old logical header and leaves duplicate values in the internal header list.",
  "difficulty": "easy",
  "source": "researcher_constructed",
  "agent_or_model": "Codex",
  "human_modified": true,
  "notes": "First state-invariant seed. It captures the invariant that Headers.update must leave one logical value per updated header regardless of presentation casing."
}
