{
  "id": "commander__005",
  "repo": "https://github.com/tj/commander.js",
  "base_commit": "ba6d13ddb4243e5913367734f8c159089ffe7834",
  "language": "JavaScript",
  "task_a": "Classify negated options as boolean options so generic option-inspection code treats boolean flags uniformly.",
  "task_b": "Resolve boolean and optional option values before falling through to the dedicated negated-option value branch.",
  "patch_a": "patch_a.patch",
  "patch_b": "patch_b.patch",
  "validation_a": "scripts/validate_a.sh",
  "validation_b": "scripts/validate_b.sh",
  "merge_result": "Patch A and Patch B apply cleanly to the same base commit with git apply; no textual conflict is reported.",
  "composition_oracle": "oracle/test_composition.mjs",
  "composition_expected": "fail",
  "conflict_type": "behavioral",
  "failure_summary": "Patch A broadens Option.isBoolean() to include negated options. Patch B checks isBoolean() before the negate-specific branch. Together, --no-cache is interpreted as a regular boolean flag and becomes true instead of false.",
  "difficulty": "easy",
  "source": "researcher_constructed",
  "agent_or_model": "Codex",
  "human_modified": true,
  "notes": "Commander.js behavioral interaction between option classification and value-resolution branch ordering."
}
