{
  "id": "commander__002",
  "repo": "https://github.com/tj/commander.js",
  "base_commit": "ba6d13ddb4243e5913367734f8c159089ffe7834",
  "language": "JavaScript",
  "task_a": "Treat common false-like environment values for boolean options as false.",
  "task_b": "Allow implied option values to override environment/config-derived values.",
  "patch_a": "patch_a.patch",
  "patch_b": "patch_b.patch",
  "validation_a": "scripts/validate_a.sh",
  "validation_b": "scripts/validate_b.sh",
  "merge_result": "Patch A and Patch B apply cleanly to the same base commit with git apply; no textual conflict is reported.",
  "composition_oracle": "oracle/test_composition.mjs",
  "composition_expected": "fail",
  "conflict_type": "configuration",
  "failure_summary": "Patch A turns DEBUG=false into an explicit env-derived false value. Patch B lets implied option values override env/config-derived values. Together, --trace can override DEBUG=false via an implied debug=true value, violating the intended configuration precedence contract.",
  "difficulty": "easy",
  "source": "researcher_constructed",
  "agent_or_model": "Codex",
  "human_modified": true,
  "notes": "Second Commander.js seed instance. This expands configuration-precedence coverage with a JavaScript-only example."
}
