{
  "id": "markupsafe__003",
  "repo": "https://github.com/pallets/markupsafe",
  "base_commit": "b2e4d9c7687be25695fffbe93a37622302b24fb1",
  "language": "Python",
  "task_a": "Prefer __html_format__(\"\") when escaping HTML-aware objects.",
  "task_b": "Delegate Markup construction for HTML-aware objects through escape.",
  "patch_a": "patch_a.patch",
  "patch_b": "patch_b.patch",
  "validation_a": "scripts/validate_a.sh",
  "validation_b": "scripts/validate_b.sh",
  "merge_result": "Patch A and Patch B apply cleanly to the same base commit with git apply; no textual conflict is reported.",
  "composition_oracle": "oracle/test_composition.py",
  "composition_expected": "fail",
  "conflict_type": "api_contract",
  "failure_summary": "Patch A makes escape prefer __html_format__(\"\") over __html__ when both are present. Patch B makes Markup construction delegate HTML-aware objects through escape. Together, Markup(obj) changes from using obj.__html__() to using obj.__html_format__(\"\"), violating the constructor's established HTML protocol contract.",
  "difficulty": "easy",
  "source": "researcher_constructed",
  "agent_or_model": "Codex",
  "human_modified": true,
  "notes": "Third MarkupSafe seed instance. It targets protocol precedence between __html__, __html_format__, escape, and Markup construction."
}
