{
  "id": "rich__002",
  "repo": "https://github.com/Textualize/rich",
  "base_commit": "9d8f9a372cc5916fd4781fec207ced7ddac2f08f",
  "language": "Python",
  "task_a": "Make append_text preserve the appended Text object's end metadata.",
  "task_b": "Refactor public Text.append(Text) to delegate to append_text.",
  "patch_a": "patch_a.patch",
  "patch_b": "patch_b.patch",
  "validation_a": "scripts/validate_a.sh",
  "validation_b": "scripts/validate_b.sh",
  "merge_result": "Patch A and Patch B apply cleanly to the same base commit with git apply; no textual conflict is reported.",
  "composition_oracle": "oracle/test_composition.py",
  "composition_expected": "fail",
  "conflict_type": "api_contract",
  "failure_summary": "Patch A changes append_text so it copies the appended Text object's end metadata. Patch B changes public append(Text) to delegate to append_text. Together, public append(Text) unexpectedly inherits the appended object's line-ending metadata, violating the public append contract that the receiver's end value is preserved.",
  "difficulty": "easy",
  "source": "researcher_constructed",
  "agent_or_model": "Codex",
  "human_modified": true,
  "notes": "Second Rich seed instance. It is intentionally distinct from rich__001: this instance targets public API metadata isolation during Text append, not padding style propagation."
}
