{
  "id": "click__004",
  "repo": "https://github.com/pallets/click",
  "base_commit": "2c8cd3ac958a7eb316d67f2d316c27086c4c0369",
  "language": "Python",
  "task_a": "Allow a command invocation to resolve a uniquely matching command-name prefix.",
  "task_b": "Allow command lookup to fall back to lowercase command names when an uppercase or mixed-case command invocation is not found exactly.",
  "patch_a": "patch_a.patch",
  "patch_b": "patch_b.patch",
  "validation_a": "scripts/validate_a.sh",
  "validation_b": "scripts/validate_b.sh",
  "merge_result": "Patch A and Patch B apply cleanly to the same base commit with git apply; no textual conflict is reported.",
  "composition_oracle": "oracle/test_composition.py",
  "composition_expected": "fail",
  "conflict_type": "behavioral",
  "failure_summary": "Patch A introduces unique-prefix command lookup. Patch B introduces lowercase fallback lookup. Together, an uppercase prefix such as STA is lowercased to sta and then resolved as a unique prefix for status, even though neither patch independently intended uppercase abbreviations.",
  "difficulty": "easy",
  "source": "researcher_constructed",
  "agent_or_model": "Codex",
  "human_modified": true,
  "notes": "Expansion seed instance. This is a controlled command-resolution conflict distinct from the underscore/dash aliasing interaction in click__002."
}
